<?xml version='1.0'?>
<?xml-stylesheet type='text/xsl' href='xslt/cdi.xsl'?>
<cdi xmlns:xsi='http://www.w3.org/2001/XMLSchema-instance' xsi:noNamespaceSchemaLocation='http://openlcb.org/trunk/prototypes/xml/schema/cdi.xsd'>

<identification>
    <manufacturer>OpenLCB</manufacturer>
    <model>OlcbBasicNode</model>
    <hardwareVersion>1.0</hardwareVersion>
    <softwareVersion>0.4</softwareVersion>
</identification>

<segment origin='0' space='253'>
    <group offset='77'>
        <name>User Identification</name>
        <description>Lets the user add his own description</description>
        <string size='12'>
            <name>Node Name</name>
        </string>
        <string size='20'>
            <name>Node Description</name>
        </string>
    </group>
</segment>

<segment origin='10' space='253'>
    <group replication='2'>
        <description>Input Pin</description>
        <eventid offset='2' >
            <name>Activation Event</name>
        </eventid>
        <eventid offset='2' >
            <name>Inactivation Event</name>
        </eventid>
    </group>
    <group replication='2'>
        <description>Output Pin</description>
        <eventid offset='2' >
            <name>Set Event</name>
        </eventid>
        <eventid offset='2' >
            <name>Reset Event</name>
        </eventid>
    </group>
</segment>

<segment origin='0' space='253'>
    <int size='4'>
        <name>Reset</name>
        <description>Controls reloading and clearing node memory. Board must be restarted for this to take effect.</description>
        <map>
            <relation><property>0xEE555EE5</property><value>(No reset)</value></relation>
            <relation><property>0</property><value>Reset all to defaults</value></relation>
            <relation><property>0xEE5533CC</property><value>Reset EventIDs to new defaults</value></relation>
        </map>
    </int>
    <int size='6'>
        <name>NodeID</name>
        <description>Set the board's NodeID. Board must be restarted for this to take effect.</description>
    </int>
</segment>

</cdi>
