<?xml version="1.0" encoding="UTF-8"?>
<?xml-stylesheet type="text/xsl" href="http://openlcb.org/trunk/prototypes/xml/xslt/cdi.xsl"?>
<cdi xmlns:xsi="http://www.w3.org/2001/XMLSchema-instance" xsi:noNamespaceSchemaLocation="http://openlcb.org/trunk/specs/schema/cdi.xsd">
  <identification>
    <manufacturer>Mustangpeak</manufacturer>
    <model>NA100</model>
    <hardwareVersion>1.0</hardwareVersion>
    <softwareVersion>0.2</softwareVersion>
    <map>
      <relation>
        <property>Description</property>
        <value>Mustangpeak NCE Adapter Node</value>
      </relation>
      <relation>
        <property>Status</property>
        <value>Prototype</value>
      </relation>
    </map>
  </identification>
  <acdi fixed="1" var="1"/>
  <segment origin="0" space="253">
    <name>Options</name>
    <description>Options for the NCE to OpenLCB Adapter</description>
    <group offset="1">
      <name>User Data</name>
      <description>Add your own unique node info here</description>
      <string size="63">
        <name>User Name</name>
      </string>
      <string size="64">
        <name>User Description</name>
      </string>
      <int>
        <name>Speed Steps</name>
        <description>DCC speed steps used to allocate a DCC Train</description>
        <map>
          <relation>
            <property>0</property>
            <value>14 Steps</value>
          </relation>
          <relation>
            <property>1</property>
            <value>28 Steps</value>
          </relation>
          <relation>
            <property>2</property>
            <value>128 Steps</value>
          </relation>
        </map>
      </int>
      <int>
        <name>Address Type</name>
        <description>Allocate a DCC train with either short or long address</description>
        <map>
          <relation>
            <property>0</property>
            <value>Short</value>
          </relation>
          <relation>
            <property>1</property>
            <value>Long</value>
          </relation>
        </map>
      </int>
    </group>
  </segment>
  <segment origin="0" space="252">
    <name>Manufacturer Data</name>
    <group>
      <name>Manufacturer Information</name>
      <description>Manufacturer-provided fixed node description</description>
      <int size="1">
        <name>Version</name>
      </int>
      <string size="12">
        <name>Manufacturer Name</name>
      </string>
      <string size="6">
        <name>Manufacturer Info</name>
      </string>
      <string size="4">
        <name>Hardware Version</name>
      </string>
      <string size="4">
        <name>Software Version</name>
      </string>
    </group>
  </segment>
  <segment origin="0" space="251">
    <name>User Data</name>
    <group offset="0">
      <name>User Data</name>
      <description>Add your own unique node info here</description>
      <int size="1">
        <name>Version</name>
      </int>
      <string size="63">
        <name>User Name</name>
      </string>
      <string size="64">
        <name>User Description</name>
      </string>
    </group>
  </segment>
</cdi>
