<?xml version="1.0" encoding="utf-8"?>
<?xml-stylesheet type='text/xsl' href='http://openlcb.org/trunk/prototypes/xml/xslt/cdi.xsl'?>
<cdi xmlns:xsi="http://www.w3.org/2001/XMLSchema-instance" xsi:noNamespaceSchemaLocation="http://openlcb.org/trunk/prototypes/xml/schema/cdi.xsd">
  <identification>
    <manufacturer>Mustangpeak</manufacturer>
    <model>CS100</model>
    <hardwareVersion>1.0</hardwareVersion>
    <softwareVersion>0.2</softwareVersion>
    <map>
      <relation>
        <property>Description</property>
        <value>Mustangpeak Command Station Node</value>
      </relation>
      <relation>
        <property>Status</property>
        <value>Prototype</value>
      </relation>
    </map>
  </identification>
  <acdi fixed="1" var="1" />
  <segment origin="0" space="253">
    <group offset="1">
      <name>User Data</name>
      <description>Add your own unique node info here</description>
      <string size="20">
        <name>User Name</name>
      </string>
      <string size="40">
        <name>User Description</name>
      </string>
    </group>
    <group>
      <name>Command Station Options</name>
      <description>Configuration options for the LCBricks Command Station</description>
      <int>
        <name>Programming Mode</name>
        <description>Selects the Programming Mode the Command Station will use to write CV's to the decoder</description>
        <map>
          <relation>
            <property>0</property>
            <value>Operation Mode (to a Main Line)</value>
          </relation>
          <relation>
            <property>1</property>
            <value>Auto Programming Mode (to a Programming Track)</value>
          </relation>
          <relation>
            <property>3</property>
            <value>Direct Mode (All Operations)</value>
          </relation>
          <relation>
            <property>4</property>
            <value>Direct Mode (Byte Operations)</value>
          </relation>
          <relation>
            <property>5</property>
            <value>Direct Mode (Bit Operations)</value>
          </relation>
          <relation>
            <property>6</property>
            <value>Paged Mode</value>
          </relation>
        </map>
      </int>
      <int>
        <name>DCC Bus Mode</name>
        <description>Select if this Command Station is the driver or receiver of the DCC bus signal (Damage may occur if more than one Command Station is selected to be a driver on the DCC bus)</description>
        <map>
          <relation>
            <property>0</property>
            <value>Command Station is a DCC Bus Driver</value>
          </relation>
          <relation>
            <property>1</property>
            <value>Command Station is a DCC Bus Receiver</value>
          </relation>
        </map>
      </int>
      <int>
        <name>Output Mode</name>
        <description>Select if this Command Station is a Main Line Node or a Programming Track Node</description>
        <map>
          <relation>
            <property>0</property>
            <value>Command Station drives a Main Line</value>
          </relation>
          <relation>
            <property></property>
            <value>Command Station drives a Programming Track</value>
          </relation>
        </map>
      </int>
    </group>
  </segment>
  <segment origin="0" space="252">
    <group>
      <name>Manufacturer Information</name>
      <description>Manufacturer-provided fixed node description</description>
      <int size="1">
        <name>Version</name>
      </int>
      <string size="12">
        <name>Manufacturer Name</name>
      </string>
      <string size="6">
        <name>Manufacturer Info</name>
      </string>
      <string size="4">
        <name>Hardware Version</name>
      </string>
      <string size="4">
        <name>Software Version</name>
      </string>
    </group>
  </segment>
  <segment origin="0" space="251">
    <group offset="0">
      <name>User Data</name>
      <description>Add your own unique node info here</description>
      <int size="1">
        <name>Version</name>
      </int>
      <string size="20">
        <name>User Name</name>
      </string>
      <string size="40">
        <name>User Description</name>
      </string>
    </group>
  </segment>
</cdi>