<?xml version='1.0'?>
<?xml-stylesheet type='text/xsl' href='http://openlcb.org/trunk/prototypes/xml/xslt/cdi.xsl'?>
<cdi xmlns:xsi='http://www.w3.org/2001/XMLSchema-instance' xsi:noNamespaceSchemaLocation='http://openlcb.org/trunk/prototypes/xml/schema/cdi.xsd'>

<identification>
    <manufacturer>OpenLCB</manufacturer>
    <model>OlcbIo</model>
    <hardwareVersion>1.0</hardwareVersion>
    <softwareVersion>0.4</softwareVersion>
</identification>

<segment origin='0' space='253'>
    <group offset='664'>
        <name>User Identification</name>
        <description>Lets the user add his own description</description>
        <string size='20'>
            <name>Node Name</name>
        </string>
        <string size='24'>
            <name>Node Description</name>
        </string>
    </group>
</segment>

<segment origin='12' space='253'>
    <group replication='8'>
        <name>Outputs</name>
        <repname>Output</repname>
        <string size='18' offset='320'>
            <name>Description</name>
        </string>
        <eventid offset='-336' ><!-- forward 320, add 18, so now back 338, then forward 2-->
            <name>Set Event</name>
        </eventid>
        <eventid offset='2' >
            <name>Reset Event</name>
        </eventid>
    </group>
    <group replication='8' offset='2'>  <!-- 2 for end of last event -->
        <name>Inputs</name>
        <repname>Input</repname>
        <string size='16' offset='320'>
            <name>Description</name>
        </string>
        <eventid offset='-336' ><!-- forward 320, add 18, so now back 338, then forward 2-->
            <name>Activation Event</name>
        </eventid>
        <eventid offset='2' >
            <name>Inactivation Event</name>
        </eventid>
    </group>
</segment>

<segment origin='0' space='253'>
    <int size='4'>
        <name>Reset</name>
        <description>Controls reloading and clearing node memory. Board must be restarted for this to take effect.</description>
        <map>
            <relation><property>3998572261</property><value>(No reset)</value></relation>
            <relation><property>3998561228</property><value>User clear: New default EventIDs, blank strings</value></relation>
            <relation><property>0</property><value>Mfg clear: Reset all, including Node ID</value></relation>
        </map>
    </int>
</segment>

</cdi>
