<?xml version="1.0" encoding="UTF-8"?>
<?xml-stylesheet type="text/xsl" href="http://openlcb.org/trunk/prototypes/xml/xslt/cdi.xsl"?>
<cdi xmlns:xsi='http://www.w3.org/2001/XMLSchema-instance' xsi:noNamespaceSchemaLocation='http://openlcb.org/trunk/prototypes/xml/schema/cdi.xsd'>

<identification>
    <manufacturer>TCH Technology</manufacturer>
    <model>OpenLCB 16 in 24 out P/C node Rev B</model>
    <hardwareVersion>1.0.3</hardwareVersion>
    <softwareVersion>0.7.7</softwareVersion>
    <map>
        <relation>
        <property>Description</property>
        <value>TCH Technology OpenLCB Node</value>
        </relation>
        <relation>
        <property>Sold to</property>
        <value>John Doe 03/21/2013</value>
        </relation>
        <relation>
        <property>Status</property>
        <value>Released 01/21/2013</value>
        </relation>
    </map>
</identification>

<segment origin='0' space='253'>
    <group offset='816'>
        <name>User Identification</name>
        <description>Add your own unique node infomation here.   Node Name Max 20 characters.</description>
        <string size='20'>
            <name>Node Name</name>
        </string>
        <string size='30'>
            <name>Node Description</name>
        </string>
    </group>
</segment>

<segment origin='10' space='253'>
    <group replication='24'>
        <name>Outputs</name>
        <repname>Output</repname>
        <string size='16' offset='860'>
            <name>Description</name>
        </string>
        <eventid offset='-874' ><!-- forward 150, add 16, back 166, then forward 2-->
            <name>Activation Event</name>
        </eventid>
        <eventid offset='2' >
            <name>Inactivation Event</name>
        </eventid>
    </group>
    <group replication='16'>
        <name>Inputs</name>
        <repname>Input</repname>
        <string size='16' offset='860'>
            <name>Description</name>
        </string>
        <eventid offset='-874' ><!-- forward 150, add 16, back 166, then forward 2-->
            <name>Set Event</name>
        </eventid>
        <eventid offset='2' >
            <name>Reset Event</name>
        </eventid>
    </group>
</segment>

<segment origin='0' space='253'>
    <int size='4'>
        <name>Reset</name>
        <description>Controls reloading and clearing node memory. Board must be restarted for this to take effect.</description>
        <map>
            <relation><property>3998572261</property><value>(No reset)</value></relation>
            <relation><property>0</property><value>Mfg clear: Reset all, including Node ID</value></relation>
            <relation><property>3998561228</property><value>User clear: New default EventIDs, blank strings </value></relation>
        </map>
    </int>
</segment>

</cdi>
