<?xml version="1.0" encoding="utf-8"?>
<?xml-stylesheet type='text/xsl' href='http://openlcb.org/trunk/prototypes/xml/xslt/cdi.xsl'?>
<cdi xmlns:xsi="http://www.w3.org/2001/XMLSchema-instance" xsi:noNamespaceSchemaLocation="http://openlcb.org/trunk/prototypes/xml/schema/cdi.xsd">
  <identification>
    <manufacturer>Mustangpeak</manufacturer>
    <model>XA100</model>
    <hardwareVersion>1.0</hardwareVersion>
    <softwareVersion>0.2</softwareVersion>
    <map>
      <relation>
        <property>Description</property>
        <value>Mustangpeak Xpressnet Adapter Node</value>
      </relation>
      <relation>
        <property>Status</property>
        <value>Prototype</value>
      </relation>
    </map>
  </identification>
  <acdi fixed="1" var="1" />
  <segment origin="1" space="253">
    <group offset="1">
      <name>User Data</name>
      <description>Add your own unique node info here</description>
      <string size="20">
        <name>User Name</name>
      </string>
      <string size="40">
        <name>User Description</name>
      </string>
    </group>
  </segment>
  <segment origin="0" space="252">
    <group>
      <name>Manufacturer Information</name>
      <description>Manufacturer-provided fixed node description</description>
      <int size="1">
        <name>Version</name>
      </int>
      <string size="12">
        <name>Manufacturer Name</name>
      </string>
      <string size="6">
        <name>Manufacturer Info</name>
      </string>
      <string size="4">
        <name>Hardware Version</name>
      </string>
      <string size="4">
        <name>Software Version</name>
      </string>
    </group>
  </segment>
  <segment origin="0" space="251">
    <group offset="0">
      <name>User Data</name>
      <description>Add your own unique node info here</description>
      <int size="1">
        <name>Version</name>
      </int>
      <string size="20">
        <name>User Name</name>
      </string>
      <string size="40">
        <name>User Description</name>
      </string>
    </group>
  </segment>
</cdi>